<?xml version="1.0"?>
<catalog xmlns="http://lizardsandpumpkins.com" xmlns:xsi="http://www.w3.org/2001/XMLSchema-instance"
         xsi:schemaLocation="http://lizardsandpumpkins.com ../../schema/catalog.xsd">
    <products>
        <product type="configurable" sku="M29540" tax_class="19%">
            <images>
                <image>
                    <file>m29540_standardview.jpg</file>
                    <label locale="de_DE">Das Hauptbild</label>
                    <label locale="en_US">The main image label for this shoe</label>
                </image>
                <image>
                    <file>m29540_backview.jpg</file>
                    <label>Yet another image label</label>
                </image>
            </images>
            <attributes>
                <attribute name="url_key">adipure-360</attribute>
                <attribute name="category">sale</attribute>
                <attribute name="category">men-running-shoes</attribute>
                <attribute name="category">specials</attribute>
                <attribute name="stock_qty">5</attribute>
                <attribute name="backorders">true</attribute>
                <attribute name="name">Adipure 360.2 Prima</attribute>
                <attribute name="price">89.95</attribute>
                <attribute name="special_price">44.97</attribute>
                <attribute name="description"><![CDATA[Adidas adiPure 360.2 Prima<br><br>
- Flex Grooves: Flexibilität für ein natürliches Laufgefühl.<br>
- Atmungsaktives Mesh: Ermöglicht Luftzirkulation, die für ein angenehmes Gefühl am Fuß sorgt<br>
- Die All-Over-Graphik Ausführung  des Schuhs gibt dir einen einzigartigen Look<br><br>
TEXTILE/SYNTHETICS]]></attribute>
                <attribute name="brand">Adidas</attribute>
                <attribute name="style">Natural-Running (Free)</attribute>
                <attribute name="gender">Damen</attribute>
                <attribute name="series">Adipure</attribute>
            </attributes>
            <variations>
                <attribute>color</attribute>
                <attribute>size</attribute>
            </variations>
            <associated_products>
                <product sku="218765-333-1" type="simple" tax_class="19%">
                    <attributes>
                        <attribute name="stock_qty">6</attribute>
                        <attribute name="backorders">false</attribute>
                        <attribute name="color" locale="en_US">Red</attribute>
                        <attribute name="color" locale="de_DE">Rot</attribute>
                        <attribute name="color" locale="fr_FR">Rouge</attribute>
                        <attribute name="size">12.5</attribute>
                        <attribute name="size_eu">47</attribute>
                    </attributes>
                </product>
                <product sku="218765-333-2" type="simple" tax_class="19%">
                    <attributes>
                        <attribute name="stock_qty">0</attribute>
                        <attribute name="backorders">false</attribute>
                        <attribute name="color" locale="en_US">Red</attribute>
                        <attribute name="color" locale="de_DE">Rot</attribute>
                        <attribute name="color" locale="fr_FR">Rouge</attribute>
                        <attribute name="size">12</attribute>
                        <attribute name="size_eu">46</attribute>
                    </attributes>
                </product>
                <product sku="218765-333-3" type="simple" tax_class="19%">
                    <attributes>
                        <attribute name="stock_qty">45</attribute>
                        <attribute name="backorders">false</attribute>
                        <attribute name="color" locale="en_US">Red</attribute>
                        <attribute name="color" locale="de_DE">Rot</attribute>
                        <attribute name="color" locale="fr_FR">Rouge</attribute>
                        <attribute name="size">11.5</attribute>
                        <attribute name="size_eu">45</attribute>
                    </attributes>
                </product>
                <product sku="218765-333-4" type="simple" tax_class="19%">
                    <attributes>
                        <attribute name="stock_qty">5</attribute>
                        <attribute name="backorders">false</attribute>
                        <attribute name="color" locale="en_US">Red</attribute>
                        <attribute name="color" locale="de_DE">Rot</attribute>
                        <attribute name="color" locale="fr_FR">Rouge</attribute>
                        <attribute name="size">10</attribute>
                        <attribute name="size_eu">43</attribute>
                    </attributes>
                </product>
                <product sku="218765-333-6" type="simple" tax_class="19%">
                    <attributes>
                        <attribute name="stock_qty">0</attribute>
                        <attribute name="backorders">true</attribute>
                        <attribute name="color" locale="en_US">Blue</attribute>
                        <attribute name="color" locale="de_DE">Blau</attribute>
                        <attribute name="color" locale="fr_FR">Bleu</attribute>
                        <attribute name="size">12</attribute>
                        <attribute name="size_eu">46</attribute>
                    </attributes>
                </product>
                <product sku="218765-333-7" type="simple" tax_class="19%">
                    <attributes>
                        <attribute name="stock_qty">5</attribute>
                        <attribute name="backorders">false</attribute>
                        <attribute name="color" locale="en_US">Blue</attribute>
                        <attribute name="color" locale="de_DE">Blau</attribute>
                        <attribute name="color" locale="fr_FR">Bleu</attribute>
                        <attribute name="size">11.5</attribute>
                        <attribute name="size_eu">45</attribute>
                    </attributes>
                </product>
            </associated_products>
        </product>
    </products>
</catalog>
